{
  "title": "FIXTURE: results - partly previous",
  "sources": [
    {
      "text": "NZZ",
      "link": {
        "url": "www.nzz.ch",
        "isValid": true
      }
    }
  ],
  "subtitle": "Möglichkeit zusätzliche Informationen als Untertitel zu erfassen",
  "notes": "Jemand musste Josef K. verleumdet haben, denn ohne dass er 'etwas Böses getan hätte, wurde er eines Morgens verhaftet.",
  "totalSeats": 200,
  "parties": [
    {
      "color": {
        "colorCode": "#004e76"
      },
      "name": "Verfassungsdemokraten",
      "seats": 55
    },
    {
      "color": {
        "colorCode": "#0084c7"
      },
      "name": "Kommunistische Partei",
      "seats": 12
    },
    {
      "color": {
        "colorCode": "#6cb8de"
      },
      "name": "Sozialdemokraten",
      "seats": 2
    },
    {
      "color": {
        "colorCode": "#d3574a"
      },
      "name": "Liberaldemokraten",
      "seats": 111,
      "previous": 212
    },
    {
      "color": {
        "colorCode": "#85b84f"
      },
      "name": "Erneuerung Japans",
      "seats": 0,
      "previous": 12
    },
    {
      "color": {
        "colorCode": "#780f03"
      },
      "name": "Erfundene Partei mit langem Namen",
      "seats": 18,
      "previous": 12
    }
  ]
}
