{
  "title": "FIXTURE: no results - only previous",
  "sources": [
    {
      "text": "NZZ",
      "link": {
        "url": "www.nzz.ch",
        "isValid": true
      }
    }
  ],
  "subtitle": "Möglichkeit zusätzliche Informationen als Untertitel zu erfassen",
  "notes": "Jemand musste Josef K. verleumdet haben, denn ohne dass er 'etwas Böses getan hätte, wurde er eines Morgens verhaftet.",
  "totalSeats": 200,
  "parties": [
    {
      "color": {
        "colorCode": "#004e76"
      },
      "name": "Verfassungsdemokraten",
      "previous": 55
    },
    {
      "color": {
        "colorCode": "#0084c7"
      },
      "name": "Kommunistische Partei",
      "previous": 12
    },
    {
      "color": {
        "colorCode": "#6cb8de"
      },
      "name": "Sozialdemokraten",
      "previous": 2
    },
    {
      "color": {
        "colorCode": "#d3574a"
      },
      "name": "Liberaldemokraten",
      "previous": 120
    },{
      "color": {
        "colorCode": "#85b84f"
      },
      "name": "Erneuerung Japans",
      "previous": 11
    }
  ]
}
